{
  "accountMutation": false,
  "backupId": "20260719T170000Z",
  "cloudxSelectorsUnchanged": true,
  "codexProcessTerminated": false,
  "controlServiceRestarted": false,
  "controlServiceStopped": true,
  "decisionDigest": "sha256:6666666666666666666666666666666666666666666666666666666666666666",
  "launchAgentLive": false,
  "launchAgentLoaded": false,
  "localCpaChanged": false,
  "localCpaPid": 300,
  "migrationBackupId": "20260719T150309Z",
  "port": 8765,
  "portClosed": true,
  "previousPid": 102,
  "quarantineRetained": true,
  "recoveryScriptPrepared": true,
  "releaseVersion": "0.1.21",
  "retainedBundleId": "20260715T122545Z",
  "schema": "cloudx.legacy-local-control-retirement.v1",
  "sigkillSent": false,
  "status": "retired"
}
